[
  {
    "id": "drill_indian_dribble",
    "name": "Indian Dribble Relay",
    "category": "dribbling",
    "ageGroups": ["u8", "u10", "u12", "u14"],
    "surface": ["turf", "grass", "indoor", "home"],
    "equipment": ["stick", "ball", "cones"],
    "duration": 10,
    "playerCount": { "min": 1, "max": 20 },
    "pedagogy": "develop",
    "emotionalCues": ["encourage", "challenge"],
    "phases": [
      {
        "name": "Setup",
        "duration": 2,
        "instructions": "Place 6 cones in a line, 1 meter apart. Players line up behind the first cone.",
        "coachingPoints": ["Ensure enough space between lanes for safety"],
        "diagram": "diagram_indian_dribble"
      },
      {
        "name": "Demonstration",
        "duration": 2,
        "instructions": "Coach demonstrates the Indian dribble: alternating forehand and reverse stick while moving the ball side-to-side through the cones. Keep the ball close, head up.",
        "coachingPoints": ["Soft hands on the stick", "Ball stays within stick length", "Eyes up between touches"]
      },
      {
        "name": "Practice",
        "duration": 6,
        "instructions": "Players dribble through the cones using the Indian dribble technique. Walk pace first, then increase speed. Repeat 4-5 times.",
        "coachingPoints": ["Flat stick on the reverse", "Smooth rhythm", "Accelerate through the last cone"]
      }
    ],
    "objectives": ["Develop close ball control", "Build comfort switching forehand to reverse", "Improve hand-eye coordination"],
    "variations": ["Add a turn at the end", "Race format between two lanes", "Blindfold one eye for advanced players"],
    "safetyNotes": ["Ensure sticks stay below knee height", "Adequate spacing between players"],
    "youtubeScript": {
      "hook": "Want silky smooth stick skills? The Indian dribble is THE foundational move every field hockey player needs to master.",
      "demo": "Watch how I keep the ball glued to my stick, alternating forehand and reverse through each cone. The secret is soft hands and a low body position.",
      "keyPoints": ["Keep hands apart on the stick for control", "Roll the wrist — don't chop at the ball", "Start slow, build speed gradually"],
      "callToAction": "Practice this for 5 minutes every day and you'll see massive improvement in just one week. Drop a comment with your best time!"
    }
  },
  {
    "id": "drill_push_pass_pairs",
    "name": "Push Pass Pairs",
    "category": "passing",
    "ageGroups": ["u6", "u8", "u10", "u12"],
    "surface": ["turf", "grass", "indoor"],
    "equipment": ["stick", "ball", "cones"],
    "duration": 10,
    "playerCount": { "min": 2, "max": 24 },
    "pedagogy": "intro",
    "emotionalCues": ["encourage", "team_build"],
    "phases": [
      {
        "name": "Setup",
        "duration": 1,
        "instructions": "Players pair up facing each other, 5 meters apart. Place a cone between them as a target line.",
        "coachingPoints": ["Adjust distance for age group — closer for U6/U8"],
        "diagram": "diagram_push_pass"
      },
      {
        "name": "Demonstration",
        "duration": 2,
        "instructions": "Coach demonstrates the push pass: left foot forward, ball at right hip, push through the ball with the flat side of the stick. Follow through toward the target.",
        "coachingPoints": ["Left foot points at target", "Hands together low on the stick", "Smooth follow-through"]
      },
      {
        "name": "Practice",
        "duration": 7,
        "instructions": "Partners push pass back and forth. Count consecutive successful passes. After 3 minutes, take one step back to increase distance.",
        "coachingPoints": ["Weight of pass — firm but controllable", "Receive with a still stick", "Communicate: 'ready!'"]
      }
    ],
    "objectives": ["Learn fundamental push pass technique", "Develop passing accuracy", "Build partner communication"],
    "variations": ["One-touch passing", "Add a defender in the middle", "Pass through a cone gate"],
    "safetyNotes": ["Keep sticks below waist height", "Watch for stray balls from other pairs"],
    "youtubeScript": {
      "hook": "The push pass is the most used skill in field hockey. Here's how to nail it every time.",
      "demo": "Step with your left foot toward your target, get low, and push through the ball. Watch the follow-through — that's where accuracy comes from.",
      "keyPoints": ["Left foot forward pointing at target", "Ball position at right hip", "Push don't hit — smooth acceleration"],
      "callToAction": "Grab a friend and try 50 passes each. Comment how many you got in a row!"
    }
  },
  {
    "id": "drill_trap_and_turn",
    "name": "Trap and Turn",
    "category": "receiving",
    "ageGroups": ["u8", "u10", "u12", "u14"],
    "surface": ["turf", "grass", "indoor"],
    "equipment": ["stick", "ball", "cones"],
    "duration": 12,
    "playerCount": { "min": 2, "max": 20 },
    "pedagogy": "develop",
    "emotionalCues": ["encourage", "celebrate"],
    "phases": [
      {
        "name": "Setup",
        "duration": 2,
        "instructions": "Set up a 10x10m grid. Player A starts at one end with the ball, Player B at the other end facing away.",
        "coachingPoints": ["Grid size adjustable based on skill level"],
        "diagram": "diagram_trap_turn"
      },
      {
        "name": "Execution",
        "duration": 8,
        "instructions": "Player A passes to Player B. On receiving, B must trap the ball, execute a 180° turn (forehand or reverse), and dribble to the end line. Alternate roles every 3 reps.",
        "coachingPoints": ["Cushion the ball on the trap — don't stab at it", "Turn on the open side away from imaginary defender", "Accelerate out of the turn"]
      },
      {
        "name": "Progression",
        "duration": 2,
        "instructions": "Add a passive defender. The receiver must scan before the ball arrives, choose which side to turn, and escape the defender.",
        "coachingPoints": ["Scan over shoulder before receiving", "Body position: side-on to see the field", "Quick first touch out of the turn"]
      }
    ],
    "objectives": ["Develop first-touch receiving under pressure", "Build scanning habits", "Improve turning technique"],
    "variations": ["Add two defenders", "Receiver calls which direction they'll turn", "Use only reverse stick trap"],
    "safetyNotes": ["Defenders must not lunge — passive pressure only in early stages"]
  },
  {
    "id": "drill_circle_shooting",
    "name": "Circle Entry & Shoot",
    "category": "shooting",
    "ageGroups": ["u10", "u12", "u14"],
    "surface": ["turf", "grass"],
    "equipment": ["stick", "ball", "cones", "goals"],
    "duration": 15,
    "playerCount": { "min": 3, "max": 16 },
    "pedagogy": "refine",
    "emotionalCues": ["challenge", "celebrate"],
    "phases": [
      {
        "name": "Setup",
        "duration": 2,
        "instructions": "Use the shooting circle (or mark one with cones). Set up 3 feeders at 45° left, center top, and 45° right of the circle. Shooter starts at the circle edge.",
        "coachingPoints": ["Ensure GK is padded up if using live keeper"],
        "diagram": "diagram_circle_shoot"
      },
      {
        "name": "Pattern 1 - Straight",
        "duration": 5,
        "instructions": "Feeder plays ball into the circle from the top. Shooter receives, takes one touch to set, and shoots. Focus on hitting the ball flat and low.",
        "coachingPoints": ["Get low for the shot", "Watch the ball onto the stick", "Aim for corners — low and hard"]
      },
      {
        "name": "Pattern 2 - Angle",
        "duration": 5,
        "instructions": "Ball fed from the right. Shooter leads into the circle, receives on the move, and shoots first-time or with one touch.",
        "coachingPoints": ["Time the lead run", "Open body to see goal and ball", "Deflections count — stick on the ground"]
      },
      {
        "name": "Pattern 3 - Reverse",
        "duration": 3,
        "instructions": "Ball fed from the left. Shooter must use reverse stick to deflect or control and shoot.",
        "coachingPoints": ["Soft reverse stick", "Redirect rather than control if possible", "Follow up for rebounds"]
      }
    ],
    "objectives": ["Develop shooting accuracy from multiple angles", "Practice circle movement", "Build confidence finishing under pressure"],
    "variations": ["Add GK", "Add a defender", "Timed challenge: most goals in 2 minutes"],
    "safetyNotes": ["All players behind the shooter when shooting", "Balls must be hit below backboard height"]
  },
  {
    "id": "drill_jab_tackle",
    "name": "Jab & Block Tackle",
    "category": "tackling",
    "ageGroups": ["u10", "u12", "u14"],
    "surface": ["turf", "grass", "indoor"],
    "equipment": ["stick", "ball", "cones"],
    "duration": 12,
    "playerCount": { "min": 2, "max": 20 },
    "pedagogy": "develop",
    "emotionalCues": ["challenge", "encourage"],
    "phases": [
      {
        "name": "Setup",
        "duration": 2,
        "instructions": "Mark a 5m-wide channel with cones, 15m long. One attacker, one defender. Attacker tries to dribble through; defender tries to win the ball.",
        "coachingPoints": ["Defender starts 5m back from the attacker"],
        "diagram": "diagram_jab_tackle"
      },
      {
        "name": "Jab Tackle",
        "duration": 5,
        "instructions": "Defender uses the jab tackle: extend the stick with the left hand only to poke the ball away. Focus on timing — wait for the attacker to push the ball ahead.",
        "coachingPoints": ["Patience — don't commit too early", "Low body position, balanced feet", "Jab and recover, don't lunge"]
      },
      {
        "name": "Block Tackle",
        "duration": 5,
        "instructions": "Defender uses the block tackle: get low, present a strong flat stick on the ground. Let the attacker run the ball into your stick. Absorb and win possession.",